========================================================================
IBM Corporation : ID Workbench V4.7.0-D46 (05/25/2018)
========================================================================
PROCESS INFORMATION : 
   Start Time    : 05/14/19 06:29:31
   O/S           : Windows Server 2008 R2 6.1
   REXX Ver      : 4.2.0
   Client Name   : d22w2k089-r.rtp.raleigh.ibm.com
   Process       : DITA map input to PDF output
   Processor     : map2pdf
   User          : xfsadmin
   Base Dir      : D:\XFSFM-AP1\wd\270718
   Temp Dir      : C:\TEMP\IDWB\idwt1243059395\XFSFM-AP1\wd\270718
   Bgn Drv Spc   : 30982 M
   FileAdd       : pdf
   IDWBCODE      : C:\DITATools\IDWB\bin
   LOCPATH       : C:\DITATools\IDWB\locale;
   file.encoding : Cp1252
   Processors    : 4
   JVM MaxMemory : 1820 M
   Jar version   : UNKNOWN
   Internal BOM  : idwbtmlt.bom
   Internal LOG  : idwbtmlt.log
   Parameters    : /I:"IBM_Connections_Chat_9.4_iOS_Documentation.ditamap" /PDF:any /WL:Error /PDFLINK:BLUE /STYLE:default /IMAGETYPES:EPS /GRAPHICS:TEMP /FONT:NONSTD /RELLINKS:DEFAULT /OUTDIR:"D:\XFSFM-AP1\wd\270718result\IBM_Connections_Chat_9.4_iOS_Documentation.ditamap_map2pdf" /H
      Parm: Input File                  (/I:)  [/IDINPUTFILE] Value: IBM_Connections_Chat_9.4_iOS_Documentation.ditamap
      Parm: Create PDF File             (/PDF:)  [/PDF_IDPDF] Value: ANY
      Parm: Warning Level               (/WL:)  [/IDWL] Value: ERROR
      Parm: Color of linkbox            (/PDFLINK:)  [/PDF_IDPDFLINK] Value: BLUE
      Parm: Style (PS)                  (/STYLE:)  [/PDF_IDSTYLE] Value: default
      Parm: Image Type(s) and order     (/IMAGETYPES:)  [/PDF_IDIMAGETYPES] Value: eps
      Parm: Graphics file               (/GRAPHICS:)  [/PDF_IDGRAPHICS] Value: TEMP
      Parm: Font Include                (/FONT:)  [/PDF_IDFONT] Value: NONSTD
      Parm: Related links Processing    (/RELLINKS:)  [/PDF_IDRELLINKS] Value: DEFAULT
      Parm: Output directory            (/OUTDIR:)  [/IDOUTDIR] Value: D:\XFSFM-AP1\wd\270718result\IBM_Connections_Chat_9.4_iOS_Documentation.ditamap_map2pdf
      Parm: Hush End Status             (/H)  [/IDH]   Value: ON
------------------------------------------------------------------------
<<< BEGIN DITA Search file contents. (ditadflt.dsh)
DIR:D:\XFSFM-AP1\wd\270718
<<< END DITA Search file contents.
 ... ID Initialization/Verification Complete ... (0)                  06:29:32
(START) -------------------- Step: 1 of 19 --------------------
Target idwbinit:
 Start Process: 1 of 19 ...                                           06:29:32
 End Process: 1 of 19 (0)                                             06:29:32
(END) -------------------- Step: 1 of 19 --------------------
(START) -------------------- Step: 2 of 19 --------------------
Target ditapreprocess:
 Start Process: 2 of 19 ...                                           06:29:32
    Your files are being retrieved. They are not all being shown in   06:29:32
    this console in order to speed up the processing and retrieval of 06:29:32
    the files. For the complete list of files, see the processing log 06:29:32
....................DITA Preprocessor Exec Command Information Process Log ....................
Executing 'C:\DITATools\IDWB\bin\omspvm.exe' with arguments:
'-load'
'C:\DITATools\IDWB\bin\hrefscan.xvc'
'-licto'
'3600'
'-f'
'C:\TEMP\IDWB\idwt1243059395\XFSFM-AP1\wd\270718\omni1471257293.args'

The ' characters around the executable and arguments are
not part of the command.

Omnimark args file contents
-l C:\DITATools\IDWB\dita\plugins\AuthoringTools\dtd\
-l C:\TEMP\IDWB\idwt1243059395\XFSFM-AP1\wd\270718\
-library C:\DITATools\IDWB\dita\plugins\AuthoringTools\dtd\dita.lib
-library C:\DITATools\IDWB\dita\usertest.lib
-library C:\DITATools\IDWB\dita\plugins\installedspec.lib
-d inputFile IBM_Connections_Chat_9.4_iOS_Documentation.ditamap
-d IDPROCESSOR map2pdf
-d mainTempDir C:\TEMP\IDWB\idwt1243059395\XFSFM-AP1\wd\270718\
-d workingDirectory \TEMP\IDWB\idwt1243059395\XFSFM-AP1\wd\270718\
-d final-output-type PDF
-d fmgr-prog-filename C:\DITATools\IDWB\bin\idwbfmgr.exe
-d startFromPath XFSFM-AP1\wd\270718\
-d searchPathFile ditadflt.dsh
-d op-system WINDOWS
-d userdir D:\XFSFM-AP1\wd\270718\
-d pluginInstallFile C:\DITATools\IDWB\install\plugin_install.xml
-log C:\TEMP\IDWB\idwt1243059395\XFSFM-AP1\wd\270718\id2114526319.log.out
....................DITA Preprocessor Exec Command Information Process Log ....................

..................... DITA Preprocessor Error Log .....................

<I>Source used for build:
DITA files: 21
Topics: 39
..................... DITA Preprocessor Error Log .....................

....................Fix job.xml file directory issues Exec Command Information Process Log ....................
Executing 'C:\DITATools\IDWB\bin\omspvm.exe' with arguments:
'-load'
'C:\DITATools\IDWB\bin\fixjob.xvc'
'-licto'
'3600'

The ' characters around the executable and arguments are
not part of the command.

Omnimark args file contents
....................Fix job.xml file directory issues Exec Command Information Process Log ....................

 Entity retrieval for c_getting_started.dita  ,  c_getting_started.dita . Return code: 0.
 Entity retrieval for c_system_requirements.dita  ,  c_system_requirements.dita . Return code: 0.
 Entity retrieval for c_installing_connections_chat.dita  ,  c_installing_connections_chat.dita . Return code: 0.
 Entity retrieval for t_adding_server_apple_device.dita  ,  t_adding_server_apple_device.dita . Return code: 0.
 Entity retrieval for starting_chat_connections.dita  ,  starting_chat_connections.dita . Return code: 0.
 Entity retrieval for t_configuring_connections.dita  ,  t_configuring_connections.dita . Return code: 0.
 Entity retrieval for c_managing_availability_network.dita  ,  c_managing_availability_network.dita . Return code: 0.
 Entity retrieval for t_loggingin.dita  ,  t_loggingin.dita . Return code: 0.
 Entity retrieval for c_using_mainscreen.dita  ,  c_using_mainscreen.dita . Return code: 0.
 Entity retrieval for t_addingcontacts.dita  ,  t_addingcontacts.dita . Return code: 0.
 Entity retrieval for t_creating_groups.dita  ,  t_creating_groups.dita . Return code: 0.
 Entity retrieval for t_changing_onlinestatus.dita  ,  t_changing_onlinestatus.dita . Return code: 0.
 Entity retrieval for c_working_with_your_contacts.dita  ,  c_working_with_your_contacts.dita . Return code: 0.
 Entity retrieval for c_textchatting_apple_device.dita  ,  c_textchatting_apple_device.dita . Return code: 0.
 Entity retrieval for t_startingachat.dita  ,  t_startingachat.dita . Return code: 0.
 Entity retrieval for c_inserting_emoticons.dita  ,  c_inserting_emoticons.dita . Return code: 0.
 Entity retrieval for c_viewing_working_chatandchathistory.dita  ,  c_viewing_working_chatandchathistory.dita . Return code: 0.
 Entity retrieval for c_audio_chatting_apple_device.dita  ,  c_audio_chatting_apple_device.dita . Return code: 0.
 Entity retrieval for c_using_sametime_unified_telephony_features_android_device.dita  ,  c_using_sametime_unified_telephony_features_android_device.dita . Return code: 0.
 Entity retrieval for t_third_party_dialer_application.dita  ,  t_third_party_dialer_application.dita . Return code: 0.
 Entity retrieval for c_video_chatting_apple_device.dita  ,  c_video_chatting_apple_device.dita . Return code: 0.
 Entity retrieval for chaticon.eps  ,  chaticon.eps , Images\ . Return code: 0.
 Entity retrieval for Chat_icon.eps  ,  Chat_icon.eps , Images\ . Return code: 0.
 Entity retrieval for happy_emoticon.eps  ,  happy_emoticon.eps , Images\ . Return code: 0.
 Entity retrieval for winking_emoticon.eps  ,  winking_emoticon.eps , Images\ . Return code: 0.
 Entity retrieval for broadsmily_emoticon.eps  ,  broadsmily_emoticon.eps , Images\ . Return code: 0.
 Entity retrieval for angry_emoticon.eps  ,  angry_emoticon.eps , Images\ . Return code: 0.
 Entity retrieval for half_emoticon.eps  ,  half_emoticon.eps , Images\ . Return code: 0.
 Entity retrieval for eyebrow_emoticon.eps  ,  eyebrow_emoticon.eps , Images\ . Return code: 0.
 Entity retrieval for sad_emoticon.eps  ,  sad_emoticon.eps , Images\ . Return code: 0.
 Entity retrieval for blushing_emoticon.eps  ,  blushing_emoticon.eps , Images\ . Return code: 0.
 Entity retrieval for goofy_emoticon.eps  ,  goofy_emoticon.eps , Images\ . Return code: 0.
 Entity retrieval for surprised_emoticon.eps  ,  surprised_emoticon.eps , Images\ . Return code: 0.
 Entity retrieval for tongueout_emoticon.eps  ,  tongueout_emoticon.eps , Images\ . Return code: 0.
 Entity retrieval for idea_emoticon.eps  ,  idea_emoticon.eps , Images\ . Return code: 0.
 Entity retrieval for yes_emoticon.eps  ,  yes_emoticon.eps , Images\ . Return code: 0.
 Entity retrieval for no_emoticon.eps  ,  no_emoticon.eps , Images\ . Return code: 0.
 Entity retrieval for thinking_emoticon.eps  ,  thinking_emoticon.eps , Images\ . Return code: 0.
 Entity retrieval for crying_emoticon.eps  ,  crying_emoticon.eps , Images\ . Return code: 0.
 End Process: 2 of 19 (0)                                             06:29:41
(END) -------------------- Step: 2 of 19 --------------------
(START) -------------------- Step: 3 of 19 --------------------
Target init-URIResolver:
 Start Process: 3 of 19 ...                                           06:29:41
 End Process: 3 of 19 (0)                                             06:29:41
(END) -------------------- Step: 3 of 19 --------------------
(START) -------------------- Step: 4 of 19 --------------------
Target dost_conrefpush:
 Start Process: 4 of 19 ...                                           06:29:41
 End Process: 4 of 19 (0)                                             06:29:41
(END) -------------------- Step: 4 of 19 --------------------
(START) -------------------- Step: 5 of 19 --------------------
Target resolveconref:
 Start Process: 5 of 19 ...                                           06:29:41
 End Process: 5 of 19 (0)                                             06:29:41
(END) -------------------- Step: 5 of 19 --------------------
(START) -------------------- Step: 6 of 19 --------------------
Target conreftopic:
 Start Process: 6 of 19 ...                                           06:29:41
 End Process: 6 of 19 (0)                                             06:29:41
(END) -------------------- Step: 6 of 19 --------------------
(START) -------------------- Step: 7 of 19 --------------------
Target resolvekeyref:
 Start Process: 7 of 19 ...                                           06:29:41
 End Process: 7 of 19 (0)                                             06:29:41
(END) -------------------- Step: 7 of 19 --------------------
(START) -------------------- Step: 8 of 19 --------------------
Target dost_keyref:
 Start Process: 8 of 19 ...                                           06:29:41
 End Process: 8 of 19 (0)                                             06:29:41
(END) -------------------- Step: 8 of 19 --------------------
(START) -------------------- Step: 9 of 19 --------------------
Target dost_coderef:
 Start Process: 9 of 19 ...                                           06:29:41
 End Process: 9 of 19 (0)                                             06:29:41
(END) -------------------- Step: 9 of 19 --------------------
(START) -------------------- Step: 10 of 19 --------------------
Target topicpull:
 Start Process: 10 of 19 ...                                          06:29:41
 End Process: 10 of 19 (0)                                            06:29:42
(END) -------------------- Step: 10 of 19 --------------------
(START) -------------------- Step: 11 of 19 --------------------
Target genmaptitlemetadata:
 Start Process: 11 of 19 ...                                          06:29:42
.......................... Map Pull Error Log ..........................

 Processing file: IBM_Connections_Chat_9.4_iOS_Documentation.ditamap Iteration (1)
 SMem: 114836552/158334976
 EMem: 83458736/158334976
.......................... Map Pull Error Log ..........................

....................Push filter attributes from map to topics Exec Command Information Process Log ....................
Executing 'C:\DITATools\IDWB\bin\omspvm.exe' with arguments:
'-load'
'C:\DITATools\IDWB\bin\pushattr.xvc'
'-licto'
'3600'
'-f'
'C:\TEMP\IDWB\idwt1243059395\XFSFM-AP1\wd\270718\omni785399933.args'

The ' characters around the executable and arguments are
not part of the command.

Omnimark args file contents
-l C:\DITATools\IDWB\dita\plugins\AuthoringTools\dtd\
-l C:\TEMP\IDWB\idwt1243059395\XFSFM-AP1\wd\270718\
-library C:\DITATools\IDWB\dita\plugins\AuthoringTools\dtd\dita.lib
-library C:\DITATools\IDWB\dita\usertest.lib
-library C:\DITATools\IDWB\dita\plugins\installedspec.lib
-d inputFile C:\TEMP\IDWB\idwt1243059395\XFSFM-AP1\wd\270718\ditamapfiles.lst
-d taxonomyFile C:\DITATools\IDWB\dita\/KC_taxonomy.ditamap
-d workingDirectory \TEMP\IDWB\idwt1243059395\XFSFM-AP1\wd\270718\
-d final-output-type PDF
-d pushgroup kc
-d pushstyle override
-log C:\TEMP\IDWB\idwt1243059395\XFSFM-AP1\wd\270718\id2114526319.log.out
....................Push filter attributes from map to topics Exec Command Information Process Log ....................

 End Process: 11 of 19 (0)                                            06:29:44
(END) -------------------- Step: 11 of 19 --------------------
(START) -------------------- Step: 12 of 19 --------------------
Target branchfilter:
 Start Process: 12 of 19 ...                                          06:29:44
 End Process: 12 of 19 (0)                                            06:29:44
(END) -------------------- Step: 12 of 19 --------------------
(START) -------------------- Step: 13 of 19 --------------------
Target genmaplinks:
 Start Process: 13 of 19 ...                                          06:29:44
 End Process: 13 of 19 (0)                                            06:29:44
(END) -------------------- Step: 13 of 19 --------------------
(START) -------------------- Step: 14 of 19 --------------------
Target updatemaplinks:
 Start Process: 14 of 19 ...                                          06:29:44
....................update map links Exec Command Information Process Log ....................
Executing 'C:\DITATools\IDWB\bin\omspvm.exe' with arguments:
'-load'
'C:\DITATools\IDWB\bin\movelink.xvc'
'-licto'
'3600'
'-f'
'C:\TEMP\IDWB\idwt1243059395\XFSFM-AP1\wd\270718\omni833066665.args'

The ' characters around the executable and arguments are
not part of the command.

Omnimark args file contents
-l C:\DITATools\IDWB\dita\plugins\AuthoringTools\dtd\
-l C:\TEMP\IDWB\idwt1243059395\XFSFM-AP1\wd\270718\
-library C:\DITATools\IDWB\dita\plugins\AuthoringTools\dtd\dita.lib
-library C:\DITATools\IDWB\dita\usertest.lib
-library C:\DITATools\IDWB\dita\plugins\installedspec.lib
-d inputFile maplinks.unordered
-d workingDirectory \TEMP\IDWB\idwt1243059395\XFSFM-AP1\wd\270718\
-d startFromPath XFSFM-AP1\wd\270718\
-log C:\TEMP\IDWB\idwt1243059395\XFSFM-AP1\wd\270718\id2114526319.log.out
....................update map links Exec Command Information Process Log ....................

 End Process: 14 of 19 (0)                                            06:29:44
(END) -------------------- Step: 14 of 19 --------------------
(START) -------------------- Step: 15 of 19 --------------------
Target mergedit:
 Start Process: 15 of 19 ...                                          06:29:44
....................mergedit Exec Command Information Process Log ....................
Executing 'C:\DITATools\IDWB\bin\omspvm.exe' with arguments:
'-load'
'C:\DITATools\IDWB\bin\mergedit.xvc'
'-licto'
'3600'
'-f'
'C:\TEMP\IDWB\idwt1243059395\XFSFM-AP1\wd\270718\omni234338830.args'

The ' characters around the executable and arguments are
not part of the command.

Omnimark args file contents
-l C:\DITATools\IDWB\dita\plugins\AuthoringTools\dtd\
-l C:\TEMP\IDWB\idwt1243059395\XFSFM-AP1\wd\270718\
-d inputfilename IBM_Connections_Chat_9.4_iOS_Documentation.ditamap
-d outputfilename IBM_Connections_Chat_9.4_iOS_Documentation.merged
-d startFromPath XFSFM-AP1\wd\270718\
-log C:\TEMP\IDWB\idwt1243059395\XFSFM-AP1\wd\270718\id2114526319.log.out
....................mergedit Exec Command Information Process Log ....................

 End Process: 15 of 19 (0)                                            06:29:45
(END) -------------------- Step: 15 of 19 --------------------
(START) -------------------- Step: 16 of 19 --------------------
Target ditatoidd:
 Start Process: 16 of 19 ...                                          06:29:45
 End Process: 16 of 19 (0)                                            06:29:47
(END) -------------------- Step: 16 of 19 --------------------
(START) -------------------- Step: 17 of 19 --------------------
Target xml2idd:
 Start Process: 17 of 19 ...                                          06:29:47
....................xml2idd Exec Command Information Process Log ....................
Executing 'C:\DITATools\IDWB\bin\omspvm.exe' with arguments:
'-load'
'C:\DITATools\IDWB\bin\xml2idd.xvc'
'-licto'
'3600'
'-f'
'C:\TEMP\IDWB\idwt1243059395\XFSFM-AP1\wd\270718\omni1630292411.args'

The ' characters around the executable and arguments are
not part of the command.

Omnimark args file contents
-l C:\TEMP\IDWB\idwt1243059395\XFSFM-AP1\wd\270718\
-d inputfilename IBM_Connections_Chat_9.4_iOS_Documentation.xid
-d outputfilename IBM_Connections_Chat_9.4_iOS_Documentation.idd
-d xmlobjpath C:\TEMP\IDWB\idwt1243059395\XFSFM-AP1\wd\270718\
-log C:\TEMP\IDWB\idwt1243059395\XFSFM-AP1\wd\270718\id2114526319.log.out
....................xml2idd Exec Command Information Process Log ....................

 End Process: 17 of 19 (0)                                            06:29:47
(END) -------------------- Step: 17 of 19 --------------------
(START) -------------------- Step: 18 of 19 --------------------
Target iddtopdf:
 Start Process: 18 of 19 ...                                          06:29:47
    Converting IBM_Connections_Chat_9.4_iOS_Documentation.idd to PDF  06:29:47
.......................... iddtopdf Error Log ..........................

========================================================================
IBM Corporation : ID Workbench V4.7.0-D46 (05/25/2018)
========================================================================
PROCESS INFORMATION : 
   Start Time    : 05/14/19 06:29:31
   O/S           : Windows Server 2008 R2 6.1
   REXX Ver      : 4.2.0
   Client Name   : d22w2k089-r.rtp.raleigh.ibm.com
   Process       : DITA map input to PDF output
   Processor     : map2pdf
   User          : xfsadmin
   Base Dir      : D:\XFSFM-AP1\wd\270718
   Temp Dir      : C:\TEMP\IDWB\idwt1243059395\XFSFM-AP1\wd\270718
   Bgn Drv Spc   : 30982 M
   FileAdd       : pdf
   IDWBCODE      : C:\DITATools\IDWB\bin
   LOCPATH       : C:\DITATools\IDWB\locale;
   file.encoding : Cp1252
   Processors    : 4
   JVM MaxMemory : 1820 M
   Jar version   : UNKNOWN
   Internal BOM  : idwbtmlt.bom
   Internal LOG  : idwbtmlt.log
   Parameters    : /I:"IBM_Connections_Chat_9.4_iOS_Documentation.ditamap" /PDF:any /WL:Error /PDFLINK:BLUE /STYLE:default /IMAGETYPES:EPS /GRAPHICS:TEMP /FONT:NONSTD /RELLINKS:DEFAULT /OUTDIR:"D:\XFSFM-AP1\wd\270718result\IBM_Connections_Chat_9.4_iOS_Documentation.ditamap_map2pdf" /H
      Parm: Input File                  (/I:)  [/IDINPUTFILE] Value: IBM_Connections_Chat_9.4_iOS_Documentation.ditamap
      Parm: Create PDF File             (/PDF:)  [/PDF_IDPDF] Value: ANY
      Parm: Warning Level               (/WL:)  [/IDWL] Value: ERROR
      Parm: Color of linkbox            (/PDFLINK:)  [/PDF_IDPDFLINK] Value: BLUE
      Parm: Style (PS)                  (/STYLE:)  [/PDF_IDSTYLE] Value: default
      Parm: Image Type(s) and order     (/IMAGETYPES:)  [/PDF_IDIMAGETYPES] Value: eps
      Parm: Graphics file               (/GRAPHICS:)  [/PDF_IDGRAPHICS] Value: TEMP
      Parm: Font Include                (/FONT:)  [/PDF_IDFONT] Value: NONSTD
      Parm: Related links Processing    (/RELLINKS:)  [/PDF_IDRELLINKS] Value: DEFAULT
      Parm: Output directory            (/OUTDIR:)  [/IDOUTDIR] Value: D:\XFSFM-AP1\wd\270718result\IBM_Connections_Chat_9.4_iOS_Documentation.ditamap_map2pdf
      Parm: Hush End Status             (/H)  [/IDH]   Value: ON
------------------------------------------------------------------------
<<< BEGIN DITA Search file contents. (ditadflt.dsh)
DIR:D:\XFSFM-AP1\wd\270718
<<< END DITA Search file contents.
 ... ID Initialization/Verification Complete ... (0)                  06:29:32
(start) -------------------- step: 1 of 19 --------------------
Target idwbinit:
 Start Process: 1 of 19 ...                                           06:29:32
 End Process: 1 of 19 (0)                                             06:29:32
(END) -------------------- Step: 1 of 19 --------------------
(start) -------------------- step: 2 of 19 --------------------
Target ditapreprocess:
 Start Process: 2 of 19 ...                                           06:29:32
    Your files are being retrieved. They are not all being shown in   06:29:32
    this console in order to speed up the processing and retrieval of 06:29:32
    the files. For the complete list of files, see the processing log 06:29:32
....................dita preprocessor exec command information process log ....................
Executing 'C:\DITATools\IDWB\bin\omspvm.exe' with arguments:
'-load'
'C:\DITATools\IDWB\bin\hrefscan.xvc'
'-licto'
'3600'
'-f'
'C:\TEMP\IDWB\idwt1243059395\XFSFM-AP1\wd\270718\omni1471257293.args'

The ' characters around the executable and arguments are
not part of the command.

Omnimark args file contents
-l C:\DITATools\IDWB\dita\plugins\AuthoringTools\dtd\
-l C:\TEMP\IDWB\idwt1243059395\XFSFM-AP1\wd\270718\
-library C:\DITATools\IDWB\dita\plugins\AuthoringTools\dtd\dita.lib
-library C:\DITATools\IDWB\dita\usertest.lib
-library C:\DITATools\IDWB\dita\plugins\installedspec.lib
-d inputFile IBM_Connections_Chat_9.4_iOS_Documentation.ditamap
-d IDPROCESSOR map2pdf
-d mainTempDir C:\TEMP\IDWB\idwt1243059395\XFSFM-AP1\wd\270718\
-d workingDirectory \TEMP\IDWB\idwt1243059395\XFSFM-AP1\wd\270718\
-d final-output-type PDF
-d fmgr-prog-filename C:\DITATools\IDWB\bin\idwbfmgr.exe
-d startFromPath XFSFM-AP1\wd\270718\
-d searchPathFile ditadflt.dsh
-d op-system WINDOWS
-d userdir D:\XFSFM-AP1\wd\270718\
-d pluginInstallFile C:\DITATools\IDWB\install\plugin_install.xml
-log C:\TEMP\IDWB\idwt1243059395\XFSFM-AP1\wd\270718\id2114526319.log.out
....................dita preprocessor exec command information process log ....................

..................... dita preprocessor error log .....................

<I>Source used for build:
DITA files: 21
Topics: 39
..................... dita preprocessor error log .....................

....................fix job.xml file directory issues exec command information process log ....................
Executing 'C:\DITATools\IDWB\bin\omspvm.exe' with arguments:
'-load'
'C:\DITATools\IDWB\bin\fixjob.xvc'
'-licto'
'3600'

The ' characters around the executable and arguments are
not part of the command.

Omnimark args file contents
....................fix job.xml file directory issues exec command information process log ....................

 Entity retrieval for c_getting_started.dita  ,  c_getting_started.dita . Return code: 0.
 Entity retrieval for c_system_requirements.dita  ,  c_system_requirements.dita . Return code: 0.
 Entity retrieval for c_installing_connections_chat.dita  ,  c_installing_connections_chat.dita . Return code: 0.
 Entity retrieval for t_adding_server_apple_device.dita  ,  t_adding_server_apple_device.dita . Return code: 0.
 Entity retrieval for starting_chat_connections.dita  ,  starting_chat_connections.dita . Return code: 0.
 Entity retrieval for t_configuring_connections.dita  ,  t_configuring_connections.dita . Return code: 0.
 Entity retrieval for c_managing_availability_network.dita  ,  c_managing_availability_network.dita . Return code: 0.
 Entity retrieval for t_loggingin.dita  ,  t_loggingin.dita . Return code: 0.
 Entity retrieval for c_using_mainscreen.dita  ,  c_using_mainscreen.dita . Return code: 0.
 Entity retrieval for t_addingcontacts.dita  ,  t_addingcontacts.dita . Return code: 0.
 Entity retrieval for t_creating_groups.dita  ,  t_creating_groups.dita . Return code: 0.
 Entity retrieval for t_changing_onlinestatus.dita  ,  t_changing_onlinestatus.dita . Return code: 0.
 Entity retrieval for c_working_with_your_contacts.dita  ,  c_working_with_your_contacts.dita . Return code: 0.
 Entity retrieval for c_textchatting_apple_device.dita  ,  c_textchatting_apple_device.dita . Return code: 0.
 Entity retrieval for t_startingachat.dita  ,  t_startingachat.dita . Return code: 0.
 Entity retrieval for c_inserting_emoticons.dita  ,  c_inserting_emoticons.dita . Return code: 0.
 Entity retrieval for c_viewing_working_chatandchathistory.dita  ,  c_viewing_working_chatandchathistory.dita . Return code: 0.
 Entity retrieval for c_audio_chatting_apple_device.dita  ,  c_audio_chatting_apple_device.dita . Return code: 0.
 Entity retrieval for c_using_sametime_unified_telephony_features_android_device.dita  ,  c_using_sametime_unified_telephony_features_android_device.dita . Return code: 0.
 Entity retrieval for t_third_party_dialer_application.dita  ,  t_third_party_dialer_application.dita . Return code: 0.
 Entity retrieval for c_video_chatting_apple_device.dita  ,  c_video_chatting_apple_device.dita . Return code: 0.
 Entity retrieval for chaticon.eps  ,  chaticon.eps , Images\ . Return code: 0.
 Entity retrieval for Chat_icon.eps  ,  Chat_icon.eps , Images\ . Return code: 0.
 Entity retrieval for happy_emoticon.eps  ,  happy_emoticon.eps , Images\ . Return code: 0.
 Entity retrieval for winking_emoticon.eps  ,  winking_emoticon.eps , Images\ . Return code: 0.
 Entity retrieval for broadsmily_emoticon.eps  ,  broadsmily_emoticon.eps , Images\ . Return code: 0.
 Entity retrieval for angry_emoticon.eps  ,  angry_emoticon.eps , Images\ . Return code: 0.
 Entity retrieval for half_emoticon.eps  ,  half_emoticon.eps , Images\ . Return code: 0.
 Entity retrieval for eyebrow_emoticon.eps  ,  eyebrow_emoticon.eps , Images\ . Return code: 0.
 Entity retrieval for sad_emoticon.eps  ,  sad_emoticon.eps , Images\ . Return code: 0.
 Entity retrieval for blushing_emoticon.eps  ,  blushing_emoticon.eps , Images\ . Return code: 0.
 Entity retrieval for goofy_emoticon.eps  ,  goofy_emoticon.eps , Images\ . Return code: 0.
 Entity retrieval for surprised_emoticon.eps  ,  surprised_emoticon.eps , Images\ . Return code: 0.
 Entity retrieval for tongueout_emoticon.eps  ,  tongueout_emoticon.eps , Images\ . Return code: 0.
 Entity retrieval for idea_emoticon.eps  ,  idea_emoticon.eps , Images\ . Return code: 0.
 Entity retrieval for yes_emoticon.eps  ,  yes_emoticon.eps , Images\ . Return code: 0.
 Entity retrieval for no_emoticon.eps  ,  no_emoticon.eps , Images\ . Return code: 0.
 Entity retrieval for thinking_emoticon.eps  ,  thinking_emoticon.eps , Images\ . Return code: 0.
 Entity retrieval for crying_emoticon.eps  ,  crying_emoticon.eps , Images\ . Return code: 0.
 End Process: 2 of 19 (0)                                             06:29:41
(END) -------------------- Step: 2 of 19 --------------------
(start) -------------------- step: 3 of 19 --------------------
Target init-URIResolver:
 Start Process: 3 of 19 ...                                           06:29:41
 End Process: 3 of 19 (0)                                             06:29:41
(END) -------------------- Step: 3 of 19 --------------------
(start) -------------------- step: 4 of 19 --------------------
Target dost_conrefpush:
 Start Process: 4 of 19 ...                                           06:29:41
 End Process: 4 of 19 (0)                                             06:29:41
(END) -------------------- Step: 4 of 19 --------------------
(start) -------------------- step: 5 of 19 --------------------
Target resolveconref:
 Start Process: 5 of 19 ...                                           06:29:41
 End Process: 5 of 19 (0)                                             06:29:41
(END) -------------------- Step: 5 of 19 --------------------
(start) -------------------- step: 6 of 19 --------------------
Target conreftopic:
 Start Process: 6 of 19 ...                                           06:29:41
 End Process: 6 of 19 (0)                                             06:29:41
(END) -------------------- Step: 6 of 19 --------------------
(start) -------------------- step: 7 of 19 --------------------
Target resolvekeyref:
 Start Process: 7 of 19 ...                                           06:29:41
 End Process: 7 of 19 (0)                                             06:29:41
(END) -------------------- Step: 7 of 19 --------------------
(start) -------------------- step: 8 of 19 --------------------
Target dost_keyref:
 Start Process: 8 of 19 ...                                           06:29:41
 End Process: 8 of 19 (0)                                             06:29:41
(END) -------------------- Step: 8 of 19 --------------------
(start) -------------------- step: 9 of 19 --------------------
Target dost_coderef:
 Start Process: 9 of 19 ...                                           06:29:41
 End Process: 9 of 19 (0)                                             06:29:41
(END) -------------------- Step: 9 of 19 --------------------
(start) -------------------- step: 10 of 19 --------------------
Target topicpull:
 Start Process: 10 of 19 ...                                          06:29:41
 End Process: 10 of 19 (0)                                            06:29:42
(END) -------------------- Step: 10 of 19 --------------------
(start) -------------------- step: 11 of 19 --------------------
Target genmaptitlemetadata:
 Start Process: 11 of 19 ...                                          06:29:42
.......................... map pull error log ..........................

 Processing file: IBM_Connections_Chat_9.4_iOS_Documentation.ditamap Iteration (1)
 SMem: 114836552/158334976
 EMem: 83458736/158334976
.......................... map pull error log ..........................

....................push filter attributes from map to topics exec command information process log ....................
Executing 'C:\DITATools\IDWB\bin\omspvm.exe' with arguments:
'-load'
'C:\DITATools\IDWB\bin\pushattr.xvc'
'-licto'
'3600'
'-f'
'C:\TEMP\IDWB\idwt1243059395\XFSFM-AP1\wd\270718\omni785399933.args'

The ' characters around the executable and arguments are
not part of the command.

Omnimark args file contents
-l C:\DITATools\IDWB\dita\plugins\AuthoringTools\dtd\
-l C:\TEMP\IDWB\idwt1243059395\XFSFM-AP1\wd\270718\
-library C:\DITATools\IDWB\dita\plugins\AuthoringTools\dtd\dita.lib
-library C:\DITATools\IDWB\dita\usertest.lib
-library C:\DITATools\IDWB\dita\plugins\installedspec.lib
-d inputFile C:\TEMP\IDWB\idwt1243059395\XFSFM-AP1\wd\270718\ditamapfiles.lst
-d taxonomyFile C:\DITATools\IDWB\dita\/KC_taxonomy.ditamap
-d workingDirectory \TEMP\IDWB\idwt1243059395\XFSFM-AP1\wd\270718\
-d final-output-type PDF
-d pushgroup kc
-d pushstyle override
-log C:\TEMP\IDWB\idwt1243059395\XFSFM-AP1\wd\270718\id2114526319.log.out
....................push filter attributes from map to topics exec command information process log ....................

 End Process: 11 of 19 (0)                                            06:29:44
(END) -------------------- Step: 11 of 19 --------------------
(start) -------------------- step: 12 of 19 --------------------
Target branchfilter:
 Start Process: 12 of 19 ...                                          06:29:44
 End Process: 12 of 19 (0)                                            06:29:44
(END) -------------------- Step: 12 of 19 --------------------
(start) -------------------- step: 13 of 19 --------------------
Target genmaplinks:
 Start Process: 13 of 19 ...                                          06:29:44
 End Process: 13 of 19 (0)                                            06:29:44
(END) -------------------- Step: 13 of 19 --------------------
(start) -------------------- step: 14 of 19 --------------------
Target updatemaplinks:
 Start Process: 14 of 19 ...                                          06:29:44
....................update map links exec command information process log ....................
Executing 'C:\DITATools\IDWB\bin\omspvm.exe' with arguments:
'-load'
'C:\DITATools\IDWB\bin\movelink.xvc'
'-licto'
'3600'
'-f'
'C:\TEMP\IDWB\idwt1243059395\XFSFM-AP1\wd\270718\omni833066665.args'

The ' characters around the executable and arguments are
not part of the command.

Omnimark args file contents
-l C:\DITATools\IDWB\dita\plugins\AuthoringTools\dtd\
-l C:\TEMP\IDWB\idwt1243059395\XFSFM-AP1\wd\270718\
-library C:\DITATools\IDWB\dita\plugins\AuthoringTools\dtd\dita.lib
-library C:\DITATools\IDWB\dita\usertest.lib
-library C:\DITATools\IDWB\dita\plugins\installedspec.lib
-d inputFile maplinks.unordered
-d workingDirectory \TEMP\IDWB\idwt1243059395\XFSFM-AP1\wd\270718\
-d startFromPath XFSFM-AP1\wd\270718\
-log C:\TEMP\IDWB\idwt1243059395\XFSFM-AP1\wd\270718\id2114526319.log.out
....................update map links exec command information process log ....................

 End Process: 14 of 19 (0)                                            06:29:44
(END) -------------------- Step: 14 of 19 --------------------
(start) -------------------- step: 15 of 19 --------------------
Target mergedit:
 Start Process: 15 of 19 ...                                          06:29:44
....................mergedit exec command information process log ....................
Executing 'C:\DITATools\IDWB\bin\omspvm.exe' with arguments:
'-load'
'C:\DITATools\IDWB\bin\mergedit.xvc'
'-licto'
'3600'
'-f'
'C:\TEMP\IDWB\idwt1243059395\XFSFM-AP1\wd\270718\omni234338830.args'

The ' characters around the executable and arguments are
not part of the command.

Omnimark args file contents
-l C:\DITATools\IDWB\dita\plugins\AuthoringTools\dtd\
-l C:\TEMP\IDWB\idwt1243059395\XFSFM-AP1\wd\270718\
-d inputfilename IBM_Connections_Chat_9.4_iOS_Documentation.ditamap
-d outputfilename IBM_Connections_Chat_9.4_iOS_Documentation.merged
-d startFromPath XFSFM-AP1\wd\270718\
-log C:\TEMP\IDWB\idwt1243059395\XFSFM-AP1\wd\270718\id2114526319.log.out
....................mergedit exec command information process log ....................

 End Process: 15 of 19 (0)                                            06:29:45
(END) -------------------- Step: 15 of 19 --------------------
(start) -------------------- step: 16 of 19 --------------------
Target ditatoidd:
 Start Process: 16 of 19 ...                                          06:29:45
 End Process: 16 of 19 (0)                                            06:29:47
(END) -------------------- Step: 16 of 19 --------------------
(start) -------------------- step: 17 of 19 --------------------
Target xml2idd:
 Start Process: 17 of 19 ...                                          06:29:47
....................xml2idd exec command information process log ....................
Executing 'C:\DITATools\IDWB\bin\omspvm.exe' with arguments:
'-load'
'C:\DITATools\IDWB\bin\xml2idd.xvc'
'-licto'
'3600'
'-f'
'C:\TEMP\IDWB\idwt1243059395\XFSFM-AP1\wd\270718\omni1630292411.args'

The ' characters around the executable and arguments are
not part of the command.

Omnimark args file contents
-l C:\TEMP\IDWB\idwt1243059395\XFSFM-AP1\wd\270718\
-d inputfilename IBM_Connections_Chat_9.4_iOS_Documentation.xid
-d outputfilename IBM_Connections_Chat_9.4_iOS_Documentation.idd
-d xmlobjpath C:\TEMP\IDWB\idwt1243059395\XFSFM-AP1\wd\270718\
-log C:\TEMP\IDWB\idwt1243059395\XFSFM-AP1\wd\270718\id2114526319.log.out
....................xml2idd exec command information process log ....................

 End Process: 17 of 19 (0)                                            06:29:47
(END) -------------------- Step: 17 of 19 --------------------
(start) -------------------- step: 18 of 19 --------------------
Target iddtopdf:
 Start Process: 18 of 19 ...                                          06:29:47
    Converting IBM_Connections_Chat_9.4_iOS_Documentation.idd to PDF  06:29:47
.......................... iddtopdf Error Log ..........................

    Converting IBM_Connections_Chat_9.4_iOS_Documentation.idd to PDF  06:29:47
....................iddtopdf Exec Command Information Process Log ....................
Executing 'iiddfpsl.bat' with arguments:
'IBM_Connections_Chat_9.4_iOS_Documentation.idd'
'/H'
'/S:.'
'/PDF:ANY'
'/PDFLINK:BLUE'
'/STYLE:default'
'/FONT:NONSTD'
'/GRAPHICS:TEMP'
'/WL:ERROR'
'/R'
'/IMAGETYPES:eps'
'/NOPS'
'/DBPS:TYPE1'

The ' characters around the executable and arguments are
not part of the command.
....................iddtopdf Exec Command Information Process Log ....................

    Calling Client/Server Taskbroker (9.68.64.89:3016)...             06:29:51
    If server not found or accessible, request will timeout in 1800 sec 06:29:53
    If your server is behind a firewall, you may need to authenticate 06:29:53
    yourself to the firewall, before running the transform or the     06:29:53
    server may not be accessible                                      06:29:53
    (S)AIX Server jtscxpp3 Processing iiddfpsl...                     19:29:52
    (S)Starting Router Setup...                                       19:29:52
    (S)...Router setup completed.                                     19:29:52
    (S)*** Begin LOCAL on AIX Server Processing *** Steps: 7          19:29:52
    (S)   Start Process: 1 of 7...                                    19:29:52
    (S)   End Process: 1 of 7 (0)                                     19:29:52
    (S)   Start Process: 2 of 7...                                    19:29:52
    (S)   End Process: 2 of 7 (0)                                     19:29:53
    (S)   Start Process: 3 of 7...                                    19:29:53
    (S)   End Process: 3 of 7 (0)                                     19:29:53
    (S)   Start Process: 4 of 7...                                    19:29:53
    (S)   End Process: 4 of 7 (0)                                     19:29:53
    (S)   Start Process: 5 of 7...                                    19:29:53
    Retrieving Entity: chaticon.eps  ,  FTEMP.FIL ...                 06:29:56
    ...Entity Retrieval Completed.(0)                                 06:29:56
    Retrieving Entity: Chat_icon.eps  ,  FTEMP.FIL ...                06:29:58
    ...Entity Retrieval Completed.(0)                                 06:29:58
    Retrieving Entity: happy_emoticon.eps  ,  FTEMP.FIL ...           06:29:59
    ...Entity Retrieval Completed.(0)                                 06:30:00
    Retrieving Entity: winking_emoticon.eps  ,  FTEMP.FIL ...         06:30:01
    ...Entity Retrieval Completed.(0)                                 06:30:01
    Retrieving Entity: broadsmily_emoticon.eps  ,  FTEMP.FIL ...      06:30:02
    ...Entity Retrieval Completed.(0)                                 06:30:03
    Retrieving Entity: angry_emoticon.eps  ,  FTEMP.FIL ...           06:30:04
    ...Entity Retrieval Completed.(0)                                 06:30:05
    Retrieving Entity: half_emoticon.eps  ,  FTEMP.FIL ...            06:30:06
    ...Entity Retrieval Completed.(0)                                 06:30:07
    Retrieving Entity: eyebrow_emoticon.eps  ,  FTEMP.FIL ...         06:30:08
    ...Entity Retrieval Completed.(0)                                 06:30:09
    Retrieving Entity: sad_emoticon.eps  ,  FTEMP.FIL ...             06:30:10
    ...Entity Retrieval Completed.(0)                                 06:30:10
    Retrieving Entity: blushing_emoticon.eps  ,  FTEMP.FIL ...        06:30:11
    ...Entity Retrieval Completed.(0)                                 06:30:12
    Retrieving Entity: goofy_emoticon.eps  ,  FTEMP.FIL ...           06:30:13
    ...Entity Retrieval Completed.(0)                                 06:30:13
    Retrieving Entity: surprised_emoticon.eps  ,  FTEMP.FIL ...       06:30:15
    ...Entity Retrieval Completed.(0)                                 06:30:15
    Retrieving Entity: tongueout_emoticon.eps  ,  FTEMP.FIL ...       06:30:16
    ...Entity Retrieval Completed.(0)                                 06:30:17
    Retrieving Entity: idea_emoticon.eps  ,  FTEMP.FIL ...            06:30:17
    ...Entity Retrieval Completed.(0)                                 06:30:18
    Retrieving Entity: yes_emoticon.eps  ,  FTEMP.FIL ...             06:30:19
    ...Entity Retrieval Completed.(0)                                 06:30:19
    Retrieving Entity: no_emoticon.eps  ,  FTEMP.FIL ...              06:30:20
    ...Entity Retrieval Completed.(0)                                 06:30:21
    Retrieving Entity: thinking_emoticon.eps  ,  FTEMP.FIL ...        06:30:22
    ...Entity Retrieval Completed.(0)                                 06:30:22
    Retrieving Entity: crying_emoticon.eps  ,  FTEMP.FIL ...          06:30:23
    ...Entity Retrieval Completed.(0)                                 06:30:24
    (S)   End Process: 5 of 7 (0)                                     19:30:23
    (S)   Start Process: 6 of 7...                                    19:30:23
    (S)   End Process: 6 of 7 (0)                                     19:30:23
    (S)   Start Process: 7 of 7...                                    19:30:23
    (S)      Processing: 1 of 12.                                     19:30:23
    (S)      Processing: 2 of 12.                                     19:30:23
    (S)      Processing: 3 of 12.                                     19:30:23
    (S)      Processing: 4 of 12.                                     19:30:23
    (S)      Processing: 5 of 12.                                     19:30:23
    (S)      Processing: 6 of 12.                                     19:30:23
    (S)      Processing: 7 of 12.                                     19:30:23
    (S)      Processing: 8 of 12.                                     19:30:24
    (S)      Processing: 9 of 12.                                     19:30:25
    (S)      Processing: 10 of 12.                                    19:30:26
    (S)      Processing: 11 of 12.                                    19:30:27
    (S)      Processing: 12 of 12.                                    19:30:27
    (S)   End Process: 7 of 7 (0)                                     19:30:30
    (S)*** Processing Completed ***                                   19:30:30
    (S)      AIX ...End Server Processing. (0*0*0*0*0*0)              19:30:30
    Files transferred from server. Starting client shutdown routinue  06:30:36
    Exiting Client.                                                   06:30:37
......................... iddtopdf Process Log .........................

 PROCESS: SGML Input to PS Output Via XyVision And Local Print         06:29:48
 =============================================================         06:29:48
 Starting ID Initialization/Verification...                            06:29:48
 Verifying Initial ID Environment...                                06:29:48
 ...Initial ID Environment verified.                                06:29:48
 Creating Temporary Directory...                                    06:29:48
 ...Temporary Directory C:\TEMP\IDWB\idwt600432 Created.            06:29:48
 Initializing/Verifying ID Files...                                 06:29:48
 Information Development Workbench 4.7.0
 © Copyright IBM Corporation 1994, 2018.
 ...ID Files Initialized/Verified. (0)                              06:29:49
 Verifying Parameters...                                            06:29:49
 ...Parameters Verified. (0)                                        06:29:49
 Finding / Verifying Input Files.                                   06:29:49
 ...Input Files Found / Verified. (0)                               06:29:49
 Completing Environment Setup...                                    06:29:49
 ...Environment Setup Complete. (0)                                 06:29:50
 ...ID Initialization/Verification Complete. (0)                       06:29:50
 Starting Router Setup...                                              06:29:50
 ...Router setup completed.                                            06:29:50
 *** Begin LOCAL/REMOTE Processing *** Steps: 3                        06:29:50
 Start Process: 1 of 3...                                           06:29:50
 End Process: 1 of 3 (0)                                            06:29:51
 Start Process: 2 of 3...                                           06:29:51
 Setting up Server Environment (2 of 3)...                          06:29:51
 Setting Up Server Parameters...                                 06:29:51
 ...Server Parameters Set up (0).                                06:29:51
 Setting Up Server Inputs...                                     06:29:51
 ...Server Inputs Set Up. (0)                                    06:29:51
 ...Server Environment set up complete.                             06:29:51
 ...Client/Server returned (status=0).                              06:30:37
 ...End Process: Client to Server (0)                               06:30:38
 Start Process: 3 of 3...                                           06:30:38
 End Process: 3 of 3 (0)                                            06:30:38
 *** Processing Completed ***                                          06:30:38
 06:30:38
 ID End Processing Started...                                          06:30:38
 Copying Files to C:\TEMP\IDWB\idwt1243059395\XFSFM-AP1\wd\270718... 06:30:38
 ...Files Copied.                                                   06:30:38
 Starting Environment/Directory cleanup...                          06:30:38
 ...Environment Cleanup Completed.                                  06:30:38
 INFO: Log Name is: IBM_Connections_Chat_9.4_iOS_Documentationps.log 06:30:38
 End of Process ( 0 ).                                                 06:30:38
......................... iddtopdf Process Log .........................

.......................... iddtopdf Error Log ..........................

------------------------------------------------------------------------     
IBM Corporation : ID Workbench V4.7.0 (05/25/2018)     
------------------------------------------------------------------------     
PROCESS INFORMATION :     
   Start Time  : 05/14/19 06:29:48     
   O/S         : WindowsNT 6.01     
   REXX Ver    : REXX-ooRexx_4.2.0(MT)_64-bit 6.04 22 Feb 2014     
   Client Name : d22w2k089-r.rtp.raleigh.ibm.com     
   Start From  : Command Line.     
   Process     : SGML Input to PS Output Via XyVision And Local Print     
   Processor   : iiddfpsl     
   User        : xfsadmin     
   Base Dir    : C:\TEMP\IDWB\idwt1243059395\XFSFM-AP1\wd\270718     
   Temp Dir    : C:\TEMP\IDWB\idwt600432     
   Bgn Drv Spc : 30980.0234 Megs     
   FileAdd     : ps     
   IDWBCODE env: C:\DITATools\IDWB\bin     
   PATH env    : C:\Windows\system32;C:\Windows;C:\Windows\System32\Wbem;C:\Windows\System32\WindowsPowerShell\v1.0\;D:\ooRexx;D:\HTML Help Workshop;C:\DITATools\IDWB\bin;     
   Internal BOM: idwbpslt.bom     
   Internal LOG: idwbpslt.log     
   Parameters  : IBM_Connections_Chat_9.4_iOS_Documentation.idd /H /S:. /PDF:ANY /PDFLINK:BLUE /STYLE:default /FONT:NONSTD /GRAPHICS:TEMP /WL:ERROR /R /IMAGETYPES:eps /NOPS /DBPS:TYPE1     
   Rexx Version  : Open Object Rexx  4.2.0     
      Parm: Input File                  (/I:)          Value: IBM_Connections_Chat_9.4_iOS_Documentation.idd
      Parm: Hush End Status             (/H)           Value: ON
      Parm: Search File                 (/S:)          Value: .
      Parm: Create PDF File             (/PDF:)        Value: ANY
      Parm: Color of linkbox            (/PDFLINK:)    Value: BLUE
      Parm: Style (PS)                  (/STYLE:)      Value: default
      Parm: Font Include                (/FONT:)       Value: NONSTD
      Parm: Graphics file               (/GRAPHICS:)   Value: TEMP
      Parm: Warning Level               (/WL:)         Value: ERROR
      Parm: Remote Processing           (/R)           Value: ON
      Parm: Image Type(s) and order     (/IMAGETYPES:) Value: eps
      Parm: No PostScript               (/NOPS)        Value: ON
      Parm: Type1/DBCS PS/PDF           (/DBPS:)       Value: TYPE1
      Parm: DTD Declaration             (/DCL:)        Value: ibmiddoc
      Parm: Sheet Range                 (/SHEET:)      Value: ALL
      Parm: Output Device Type          (/DEV:)        Value: NONE
      Parm: XyVision Processing Level   (/PRCLVL:)     Value: PROD
      Parm: Related links Processing    (/RELLINKS:)   Value: DEFAULT
------------------------------------------------------------------------     
Input File C:\TEMP\IDWB\idwt1243059395\XFSFM-AP1\wd\270718\IBM_Connections_Chat_9.4_iOS_Documentation.idd copied to C:\TEMP\IDWB\idwt600432.     
INFO: Default SearchFile CREATED: idwbdflt.sch.     
INFO: DITA Default SearchFile CREATED: ditadflt.dsh.     
   INFO Output Directory : C:\TEMP\IDWB\idwt1243059395\XFSFM-AP1\wd\270718     
------------------------------------------------------------------------     
<<< Begin Network Information     
Windows IP Configuration     
   Host Name . . . . . . . . . . . . : d22w2k089-r     
   Primary Dns Suffix  . . . . . . . : rtp.raleigh.ibm.com     
   Node Type . . . . . . . . . . . . : Hybrid     
   IP Routing Enabled. . . . . . . . : No     
   WINS Proxy Enabled. . . . . . . . : No     
   DNS Suffix Search List. . . . . . : rtp.raleigh.ibm.com     
                                       raleigh.ibm.com     
                                       ibm.com     
Ethernet adapter Local Area Connection 9:     
   Connection-specific DNS Suffix  . : rtp.raleigh.ibm.com     
   Description . . . . . . . . . . . : vmxnet3 Ethernet Adapter #8     
   Physical Address. . . . . . . . . : 00-50-56-BA-2B-9A     
   DHCP Enabled. . . . . . . . . . . : No     
   Autoconfiguration Enabled . . . . : Yes     
   IPv4 Address. . . . . . . . . . . : 9.37.23.208(Preferred)      
   Subnet Mask . . . . . . . . . . . : 255.255.255.0     
   Default Gateway . . . . . . . . . : 9.37.23.1     
   DNS Servers . . . . . . . . . . . : 9.42.89.65     
                                       9.42.106.2     
                                       9.42.106.3     
   NetBIOS over Tcpip. . . . . . . . : Enabled     
<<< End Network Information     
------------------------------------------------------------------------     
------------------------------------------------------------------------
<<< BEGIN Search file contents. (idwbdflt.sch)
FILE:C:\TEMP\IDWB\idwt1243059395\XFSFM-AP1\wd\270718
<<< END Search file contents.
------------------------------------------------------------------------
------------------------------------------------------------------------
<<< BEGIN DITA Search file contents. (ditadflt.dsh)
DIR:C:\TEMP\IDWB\idwt1243059395\XFSFM-AP1\wd\270718\
<<< END DITA Search file contents.
------------------------------------------------------------------------
INFO: Server Side sourcing turned off.     
INFO: Transferring files in compressed format.     
* * * * * * * * * * * * * * * * * * * * * * * * * * * * * * * * * * * *      
<<<>>> Processing Started: 05/14/19 06:29:50     
<<<>>> Number of Processing Steps: 3     
      
(start) ------------------------- step: 1 of 3 -------------------------     
Step: 1 return code: 0     
(END) -------------------------- Step: 1 of 3 --------------------------     
      
(start) ------------------------- step: 2 of 3 -------------------------     
INFO: Fireworx Taskbroker: 9.68.64.89:3016     
idwbclnt->WIN Client: START.
 Server Type Defined: AIX.
INFO Image retrieved as:  chaticon.eps     
Entity retrieval for chaticon.eps  ,  FTEMP.FIL . Return code: 0.     
INFO Image retrieved as:  Chat_icon.eps     
Entity retrieval for Chat_icon.eps  ,  FTEMP.FIL . Return code: 0.     
INFO Image retrieved as:  happy_emoticon.eps     
Entity retrieval for happy_emoticon.eps  ,  FTEMP.FIL . Return code: 0.     
INFO Image retrieved as:  winking_emoticon.eps     
Entity retrieval for winking_emoticon.eps  ,  FTEMP.FIL . Return code: 0.     
INFO Image retrieved as:  broadsmily_emoticon.eps     
Entity retrieval for broadsmily_emoticon.eps  ,  FTEMP.FIL . Return code: 0.     
INFO Image retrieved as:  angry_emoticon.eps     
Entity retrieval for angry_emoticon.eps  ,  FTEMP.FIL . Return code: 0.     
INFO Image retrieved as:  half_emoticon.eps     
Entity retrieval for half_emoticon.eps  ,  FTEMP.FIL . Return code: 0.     
INFO Image retrieved as:  eyebrow_emoticon.eps     
Entity retrieval for eyebrow_emoticon.eps  ,  FTEMP.FIL . Return code: 0.     
INFO Image retrieved as:  sad_emoticon.eps     
Entity retrieval for sad_emoticon.eps  ,  FTEMP.FIL . Return code: 0.     
INFO Image retrieved as:  blushing_emoticon.eps     
Entity retrieval for blushing_emoticon.eps  ,  FTEMP.FIL . Return code: 0.     
INFO Image retrieved as:  goofy_emoticon.eps     
Entity retrieval for goofy_emoticon.eps  ,  FTEMP.FIL . Return code: 0.     
INFO Image retrieved as:  surprised_emoticon.eps     
Entity retrieval for surprised_emoticon.eps  ,  FTEMP.FIL . Return code: 0.     
INFO Image retrieved as:  tongueout_emoticon.eps     
Entity retrieval for tongueout_emoticon.eps  ,  FTEMP.FIL . Return code: 0.     
INFO Image retrieved as:  idea_emoticon.eps     
Entity retrieval for idea_emoticon.eps  ,  FTEMP.FIL . Return code: 0.     
INFO Image retrieved as:  yes_emoticon.eps     
Entity retrieval for yes_emoticon.eps  ,  FTEMP.FIL . Return code: 0.     
INFO Image retrieved as:  no_emoticon.eps     
Entity retrieval for no_emoticon.eps  ,  FTEMP.FIL . Return code: 0.     
INFO Image retrieved as:  thinking_emoticon.eps     
Entity retrieval for thinking_emoticon.eps  ,  FTEMP.FIL . Return code: 0.     
INFO Image retrieved as:  crying_emoticon.eps     
Entity retrieval for crying_emoticon.eps  ,  FTEMP.FIL . Return code: 0.     
idwbclnt-> WIN Client: END (0).
idwbclnt-> Waiting for upto 60 seconds for the client/server connection to terminate.
idwbclnt-> csclose cstat (0) csrc (0).
Step: 2 return code: 0     
<<<>>>     
-------------------------------------------------------------
<><><><><><><><><> SERVER jtscxpp3 JOB LOG <><><><><><><><><>
AIX SERVER START (0) (idremote.rmx) - Tue May 14 19:29:51 2019
ID Workbench Release: 4.6.8 Service: 0. Date: 7/17/2015.
Cwd_path is /home/idwbcs1/idwb/temp/idws11534572_3469.



Compression is turned on.

List </home/idwbcs1/idwb/bin/include.srv> does not exist or cannot be read.
List </home/idwbcs1/idwb/bin/exclude.srv> does not exist or cannot be read.
--------------------------------------------------------     
<>             PROCESS LOG FROM AIX SERVER            <>     
--------------------------------------------------------     
AIX Server Processing Start: 05/14/19 19:29:52     
ID Workbench V4.6.29 (0) (1/18/2017)     
------------------------------------------------------------------------     
ID Workbench XPP V4.6.30 (0) (02/15/2017)     
------------------------------------------------------------------------     
* * * * * * * * * * * * * * * * * * * * * * * * * * * * * * * * * * * *      
<<<>>> Processing Started: 05/14/19 19:29:52     
<<<>>> Number of Processing Steps: 7     
      
(start) ------------------------- step: 1 of 7 -------------------------     
Step: 1 return code: 0     
(END) -------------------------- Step: 1 of 7 --------------------------     
      
(start) ------------------------- step: 2 of 7 -------------------------     
Step: 2 return code: 0     
      
........................... step 2 error log ...........................     
>>>IDDOC_CPAGE IBM-850<<<
      
........................... step 2 error log ...........................     
(END) -------------------------- Step: 2 of 7 --------------------------     
      
(start) ------------------------- step: 3 of 7 -------------------------     
Step: 3 return code: 0     
      
........................... step 3 error log ...........................     

------------------------------------------------------------------
IDWB Omnimark code for XPP (Release 4.6.30) 
     compiled at 15:43:43 on 2017-02-16

      
........................... step 3 error log ...........................     
(END) -------------------------- Step: 3 of 7 --------------------------     
      
(start) ------------------------- step: 4 of 7 -------------------------     
Step: 4 return code: 0     
(END) -------------------------- Step: 4 of 7 --------------------------     
      
(start) ------------------------- step: 5 of 7 -------------------------     
Entity Retrieval for file: chaticon.eps Completed (0)
Entity Retrieval for file: Chat_icon.eps Completed (0)
Entity Retrieval for file: happy_emoticon.eps Completed (0)
Entity Retrieval for file: winking_emoticon.eps Completed (0)
Entity Retrieval for file: broadsmily_emoticon.eps Completed (0)
Entity Retrieval for file: angry_emoticon.eps Completed (0)
Entity Retrieval for file: half_emoticon.eps Completed (0)
Entity Retrieval for file: eyebrow_emoticon.eps Completed (0)
Entity Retrieval for file: sad_emoticon.eps Completed (0)
Entity Retrieval for file: blushing_emoticon.eps Completed (0)
Entity Retrieval for file: goofy_emoticon.eps Completed (0)
Entity Retrieval for file: surprised_emoticon.eps Completed (0)
Entity Retrieval for file: tongueout_emoticon.eps Completed (0)
Entity Retrieval for file: idea_emoticon.eps Completed (0)
Entity Retrieval for file: yes_emoticon.eps Completed (0)
Entity Retrieval for file: no_emoticon.eps Completed (0)
Entity Retrieval for file: thinking_emoticon.eps Completed (0)
Entity Retrieval for file: crying_emoticon.eps Completed (0)
Step: 5 return code: 0     
(END) -------------------------- Step: 5 of 7 --------------------------     
      
(start) ------------------------- step: 6 of 7 -------------------------     
Step: 6 return code: 0     
(END) -------------------------- Step: 6 of 7 --------------------------     
      
(start) ------------------------- step: 7 of 7 -------------------------     
..................................................     
Begin Step: 1 of 12     
      
      
End Step: 1 of 12 (0)     
..................................................     
Begin Step: 2 of 12     
      
Step: 7 return code: 0     
      
End Step: 2 of 12 (0)     
..................................................     
Begin Step: 3 of 12     
      
Pass 1, Transformation table: idclean
Transformed 15000 bytes
Transformed 30000 bytes
Transformed 45000 bytes
Transformed 60000 bytes
Transformed 75000 bytes
Transformed 82674 bytes
      
End Step: 3 of 12 (0)     
..................................................     
Begin Step: 4 of 12     
      
Pass 1, Transformation table: movepunc
Transformed 15000 bytes
Transformed 30000 bytes
Transformed 45000 bytes
Transformed 60000 bytes
Transformed 75000 bytes
Transformed 82328 bytes
      
End Step: 4 of 12 (0)     
..................................................     
Begin Step: 5 of 12     
      
Pass 1, Transformation table: rmindex
Transformed 15000 bytes
Transformed 30000 bytes
Transformed 45000 bytes
Transformed 60000 bytes
Transformed 75000 bytes
Transformed 82334 bytes
      
End Step: 5 of 12 (0)     
..................................................     
Begin Step: 6 of 12     
      
      
End Step: 6 of 12 (0)     
..................................................     
Begin Step: 7 of 12     
      

toxsf V8.0  XSFREV=103

    Opened 'tout8' 
   Created 'job' 

... exit toxsf ...
      
End Step: 7 of 12 (0)     
..................................................     
Begin Step: 8 of 12     
      
Pages in document: 27
      
End Step: 8 of 12 (0)     
..................................................     
Begin Step: 9 of 12     
      
Pages in document: 27
      
End Step: 9 of 12 (0)     
..................................................     
Begin Step: 10 of 12     
      
Pages in document: 27
      
End Step: 10 of 12 (0)     
..................................................     
Begin Step: 11 of 12     
      
      
End Step: 11 of 12 (0)     
..................................................     
Begin Step: 12 of 12     
      
Waiting to lock ../_job_xref file
Created PDF successfully
      
End Step: 12 of 12 (0)     
..................................................     
      
Step: 7 return code: 0     
(END) -------------------------- Step: 7 of 7 --------------------------     
<<<>>> Processing End: 05/14/19 19:30:30     
Return Code From Processing: 0.     
* * * * * * * * * * * * * * * * * * * * * * * * * * * * * * * * * * * *      
AIX Server Processing End: 05/14/19 19:30:30 Return: 0*0*0*0*0*0     
--------------------------------------------------------     
<>           END PROCESS LOG FROM AIX SERVER          <>     
--------------------------------------------------------     
AIX SERVER END - (0)(0*0*0*0*0*0) - Tue May 14 19:30:30 2019
-------------------------------------------------------------
Cmd:zip -q "IBM_Connections_Chat_9.4_iOS_Documentation.pdf.zip" "IBM_Connections_Chat_9.4_iOS_Documentation.pdf". Ret Code(0)
<<<>>>     
<<<>>>     
(END) -------------------------- Step: 2 of 3 --------------------------     
      
(start) ------------------------- step: 3 of 3 -------------------------     
INFO: Local Print: NONE. No local printing.     
(END) -------------------------- Step: 3 of 3 --------------------------     
<<<>>> Processing End: 05/14/19 06:30:38     
Return Code From Processing: 0.     
* * * * * * * * * * * * * * * * * * * * * * * * * * * * * * * * * * * *      
Output File IBM_Connections_Chat_9.4_iOS_Documentation.pdf copied to C:\TEMP\IDWB\idwt1243059395\XFSFM-AP1\wd\270718.     
      
*** statistics ***     
NUMBER OF FATALS REPORTED: 0     
NUMBER OF ERRORS REPORTED: 0     
NUMBER OF WARNINGS REPORTED: 0     
Number of Information messages: 0     
      
Output File C:\TEMP\IDWB\idwt600432\idwbpslt.bom copied to C:\TEMP\IDWB\idwt1243059395\XFSFM-AP1\wd\270718\IBM_Connections_Chat_9.4_iOS_Documentationps.bom.     
Output File C:\TEMP\IDWB\idwt600432\idwbpslt.log copied to C:\TEMP\IDWB\idwt1243059395\XFSFM-AP1\wd\270718\IBM_Connections_Chat_9.4_iOS_Documentationps.log.     
End Time: 05/14/19 06:30:38     
<<< END OF LOG FILE >>>     
------------------------------------------------------------------------     
.......................... iddtopdf Error Log ..........................

 End Process: 18 of 19 (0)                                            06:30:38
(END) -------------------- Step: 18 of 19 --------------------
(START) -------------------- Step: 19 of 19 --------------------
Target map2pdf:
 Start Process: 19 of 19 ...                                          06:30:38
    Post processing                                                   06:30:38
    Copying 2 output files to the output directory D:\XFSFM-AP1\wd\270718result\IBM_Connections_Chat_9.4_iOS_Documentation.ditamap_map2pdf 06:30:38
Output File IBM_Connections_Chat_9.4_iOS_Documentation.idd copied to D:\XFSFM-AP1\wd\270718result\IBM_Connections_Chat_9.4_iOS_Documentation.ditamap_map2pdf\IBM_Connections_Chat_9.4_iOS_Documentation.idd
Output File IBM_Connections_Chat_9.4_iOS_Documentation.pdf copied to D:\XFSFM-AP1\wd\270718result\IBM_Connections_Chat_9.4_iOS_Documentation.ditamap_map2pdf\IBM_Connections_Chat_9.4_iOS_Documentation.pdf
 End Process: 19 of 19 (0)                                            06:30:39
(END) -------------------- Step: 19 of 19 --------------------
 BUILD SUCCESSFUL. 1 minute 7 seconds                                 06:30:39
<I><I><I><I><I><I><I><I><I><I><I><I><I><I><I><I><I><I><I><I>
BUILD SUCCESSFUL. Total build time: 1 minute 7 seconds
<I><I><I><I><I><I><I><I><I><I><I><I><I><I><I><I><I><I><I><I>
 
*** STATISTICS ***
Number of Fatals Reported: 0
Number of Errors Reported: 0
Number of Warnings Reported: 0
Number of Information messages: 0
 
 INFO: Log Name is: IBM_Connections_Chat_9.4_iOS_Documentationpdf.log 06:30:39
Log File C:\TEMP\IDWB\idwt1243059395\XFSFM-AP1\wd\270718\idwbtmlt.log copied to D:\XFSFM-AP1\wd\270718\IBM_Connections_Chat_9.4_iOS_Documentationpdf.log
Bom File C:\TEMP\IDWB\idwt1243059395\XFSFM-AP1\wd\270718\idwbtmlt.bom copied to D:\XFSFM-AP1\wd\270718\IBM_Connections_Chat_9.4_iOS_Documentationpdf.bom
End Time: 05/14/19 06:30:39
<<< END OF LOG FILE >>>
